{
  "captureStatus": [],
  "completeness": {
    "kind": "provisional",
    "reasons": [
      "capture-facts-unavailable",
      "policy-unavailable"
    ]
  },
  "conventions": {
    "kind": "no-alias-table"
  },
  "effects": [
    {
      "count": 2,
      "id": "e_8129af10de8e7976",
      "identity": {
        "name": "POST",
        "scope": "@opentelemetry/instrumentation-http",
        "service": "public-api",
        "spanKind": "server"
      },
      "kind": "unclassified",
      "linkage": {
        "kind": "unlinked"
      },
      "occurrences": [
        {
          "deliveries": [
            1
          ],
          "matched": {
            "aliases": [],
            "classification": "fallback.unclassified",
            "scrubbers": []
          },
          "service": "public-api",
          "spanId": "051581bf3cb55c13",
          "traceId": "5b8aa5a2d2c872e8321cf37308d69df2"
        },
        {
          "deliveries": [
            2
          ],
          "matched": {
            "aliases": [],
            "classification": "fallback.unclassified",
            "scrubbers": []
          },
          "service": "public-api",
          "spanId": "a3ce929d0e0e4736",
          "traceId": "7c9e6679742540de944be07fc1f90ae7"
        }
      ],
      "suppression": {
        "kind": "none"
      }
    }
  ],
  "exclusions": [],
  "inputs": [
    {
      "kind": "otlp-json-fragment",
      "sequence": 1,
      "sha256": "sha256:8654ecf64a9fdc7c209272906af1396931d90c133412f3931c2ce20795c3c0be"
    },
    {
      "kind": "otlp-json-fragment",
      "sequence": 2,
      "sha256": "sha256:328cd6fa4829422a21aecd31c0883f9feebd8f4debdab5a82a7bd0bfa95b2f1e"
    }
  ],
  "kind": "effect-set",
  "limitations": [],
  "normalizer": {
    "rulesetDigest": "sha256:dc51982f1985d3c0ce8c9fdeb0b329f7d2dec81b313e2f1bb01ac4fef62c954d",
    "version": "0.1.0"
  },
  "policy": {
    "kind": "unavailable"
  },
  "schemaVersion": 1,
  "scope": {
    "activities": [],
    "kind": "capsule-session",
    "sessionId": "synthetic-two-real-occurrences"
  }
}
