{
  "captureStatus": [],
  "completeness": {
    "kind": "provisional",
    "reasons": [
      "capture-facts-unavailable",
      "policy-unavailable"
    ]
  },
  "conventions": {
    "kind": "no-alias-table"
  },
  "effects": [
    {
      "count": 1,
      "id": "e_a72fba0613248891",
      "identity": {
        "name": "POST",
        "scope": "@opentelemetry/instrumentation-http",
        "service": "public-api",
        "spanKind": "client"
      },
      "kind": "unclassified",
      "linkage": {
        "kind": "unlinked"
      },
      "occurrences": [
        {
          "deliveries": [
            1,
            2
          ],
          "matched": {
            "aliases": [],
            "classification": "fallback.unclassified",
            "scrubbers": []
          },
          "service": "public-api",
          "spanId": "5fb397be34d26b51",
          "traceId": "5b8aa5a2d2c872e8321cf37308d69df2"
        }
      ],
      "suppression": {
        "kind": "none"
      }
    }
  ],
  "exclusions": [],
  "inputs": [
    {
      "kind": "otlp-json-fragment",
      "sequence": 1,
      "sha256": "sha256:1ff708ac67f6259e96d872ea63c46bd814dceb168357d5a53cf67bba74b27472"
    },
    {
      "kind": "otlp-json-fragment",
      "sequence": 2,
      "sha256": "sha256:876b3c008dd0e3e2e3fc034188af31cbd5549be0dc62fa2b16c0fd9b2470e4e7"
    }
  ],
  "kind": "effect-set",
  "limitations": [
    {
      "deliveries": [
        1,
        2
      ],
      "kind": "conflicting-duplicate-delivery",
      "retained": 1,
      "service": "public-api",
      "spanId": "5fb397be34d26b51",
      "traceId": "5b8aa5a2d2c872e8321cf37308d69df2"
    }
  ],
  "normalizer": {
    "rulesetDigest": "sha256:dc51982f1985d3c0ce8c9fdeb0b329f7d2dec81b313e2f1bb01ac4fef62c954d",
    "version": "0.1.0"
  },
  "policy": {
    "kind": "unavailable"
  },
  "schemaVersion": 1,
  "scope": {
    "activities": [],
    "kind": "capsule-session",
    "sessionId": "synthetic-conflicting-delivery"
  }
}
